{
  "id": "d9cd0bed-1b49-4b5e-a7bd-064b8d177231",
  "name": "Fall Semester 2017 Due Date Schedule",
  "description": "An example fixed due date schedule",
  "schedules": [
    {
      "from": "2017-08-18",
      "to": "2017-12-05",
      "due": "2017-12-14"
    },
    {
      "from": "0000-00-00",
      "to": "0000-00-00",
      "due": "0000-00-00"
    }
  ]
}
